"BROKEN","EPIC","FAILED","FEATURE","PASSED","SKIPPED","STORY","UNKNOWN"
"0","Epic: Working with waits","0","Feature: Waits Tests","1","0","Story: Waits","0"
"0","Epic: Working with print","0","Feature: PrintOptions Tests","1","0","Story: Orientation","0"
"0","Epic: Working with web tables","0","Feature: Tables Tests","1","0","Story: Get table cell value","0"
"0","Epic: Working with Virtual Authenticator","0","Feature: Virtual Authenticator Tests","1","0","Story: virtual authenticator options","0"
"0","Epic: Working with web drivers","1","Feature: ChromeDriver","2","0","Story: Navigate to a URL","0"
"0","","0","","3","0","","0"
"0","Epic: Working with Lists","0","Feature: Select List Tests","1","0","Story: Single select list","0"
"0","Epic: Working with browser windows","0","Feature: Windows Tests","1","0","Story: Handles","0"
"0","Epic: Working with keys","0","Feature: keys Tests","1","0","Story: Actions","0"
"0","Epic: Working with alerts","0","Feature: Alerts Tests","1","0","Story: Basic alert","0"
"0","Epic: Working with saving","0","Feature: Saving Tests","1","0","Story: Save page","0"
"0","Epic: Working with page navigation","0","Feature: Navigation Tests","1","0","Story: driver","0"
"0","Epic: Working with iframes","0","Feature: Iframe Tests","1","0","Story: Forms iframe","0"
"0","Epic: Working with mouse","0","Feature: Mouse Tests","1","0","Story: Actions","0"
